{
  "schemaVersion": 1,
  "sequenceId": "cursor-does-not-block-release",
  "provenance": "bug_fix",
  "checkpoints": [
    {
      "atMs": 4,
      "input": {
        "pressedKeys": [],
        "pressedMouseButtons": [],
        "connectedDevices": [],
        "lastResetReason": null,
        "cursorPosition": { "x": 30.0, "y": 40.0 }
      },
      "model": {
        "leftHandDown": false,
        "rightHandDown": false,
        "activeKeyOverlays": [],
        "parameters": { "CatParamLeftHandDown": 0.0 },
        "activeMotion": null,
        "activeExpression": null
      }
    }
  ]
}
