{
  "schemaVersion": 1,
  "sequenceId": "keyboard-modifiers-and-repeat",
  "provenance": "product_decision",
  "checkpoints": [
    {
      "atMs": 500,
      "input": {
        "pressedKeys": ["ControlLeft", "KeyA", "ShiftLeft"],
        "pressedMouseButtons": [],
        "connectedDevices": [],
        "lastResetReason": null
      },
      "model": {
        "leftHandDown": true,
        "rightHandDown": false,
        "activeKeyOverlays": [{ "key": "KeyA", "side": "left" }],
        "parameters": { "CatParamLeftHandDown": 1.0 },
        "activeMotion": null,
        "activeExpression": null
      }
    },
    {
      "atMs": 1020,
      "input": {
        "pressedKeys": [],
        "pressedMouseButtons": [],
        "connectedDevices": [],
        "lastResetReason": null
      },
      "model": {
        "leftHandDown": false,
        "rightHandDown": false,
        "activeKeyOverlays": [],
        "parameters": { "CatParamLeftHandDown": 0.0 },
        "activeMotion": null,
        "activeExpression": null
      }
    }
  ]
}
