{
  "schemaVersion": 1,
  "sequenceId": "gamepad-reconnect-reset",
  "provenance": "bug_fix",
  "checkpoints": [
    {
      "atMs": 10,
      "input": {
        "pressedKeys": [],
        "pressedMouseButtons": [],
        "connectedDevices": ["fixture-pad-1"],
        "lastResetReason": null
      },
      "model": {
        "leftHandDown": true,
        "rightHandDown": false,
        "activeKeyOverlays": [{ "key": "GamepadSouth", "side": "left" }],
        "parameters": {
          "GamepadEastDown": 0.0,
          "GamepadSouthDown": 1.0
        },
        "activeMotion": null,
        "activeExpression": null
      }
    },
    {
      "atMs": 40,
      "input": {
        "pressedKeys": [],
        "pressedMouseButtons": [],
        "connectedDevices": [],
        "lastResetReason": null
      },
      "model": {
        "leftHandDown": false,
        "rightHandDown": false,
        "activeKeyOverlays": [],
        "parameters": {
          "GamepadEastDown": 0.0,
          "GamepadSouthDown": 0.0
        },
        "activeMotion": null,
        "activeExpression": null
      }
    },
    {
      "atMs": 60,
      "input": {
        "pressedKeys": [],
        "pressedMouseButtons": [],
        "connectedDevices": ["fixture-pad-2"],
        "lastResetReason": null
      },
      "model": {
        "leftHandDown": false,
        "rightHandDown": true,
        "activeKeyOverlays": [{ "key": "GamepadEast", "side": "right" }],
        "parameters": {
          "GamepadEastDown": 1.0,
          "GamepadSouthDown": 0.0
        },
        "activeMotion": null,
        "activeExpression": null
      }
    },
    {
      "atMs": 70,
      "input": {
        "pressedKeys": [],
        "pressedMouseButtons": [],
        "connectedDevices": [],
        "lastResetReason": "device_removed"
      },
      "model": {
        "leftHandDown": false,
        "rightHandDown": false,
        "activeKeyOverlays": [],
        "parameters": {
          "GamepadEastDown": 0.0,
          "GamepadSouthDown": 0.0
        },
        "activeMotion": null,
        "activeExpression": null
      }
    }
  ]
}
