{
  "schemaVersion": 1,
  "sequenceId": "input-recovery-lifecycle",
  "provenance": "bug_fix",
  "checkpoints": [
    {
      "atMs": 10,
      "input": {
        "pressedKeys": [],
        "pressedMouseButtons": [],
        "connectedDevices": [],
        "lastResetReason": "queue_overflow"
      },
      "model": {
        "leftHandDown": false,
        "rightHandDown": false,
        "activeKeyOverlays": [],
        "parameters": {
          "CatParamLeftHandDown": 0.0,
          "CatParamRightHandDown": 0.0,
          "GamepadSouthDown": 0.0,
          "ParamMouseLeftDown": 0.0
        },
        "activeMotion": null,
        "activeExpression": null
      }
    },
    {
      "atMs": 21,
      "input": {
        "pressedKeys": [],
        "pressedMouseButtons": [],
        "connectedDevices": ["fixture-pad"],
        "lastResetReason": "queue_overflow"
      },
      "model": {
        "leftHandDown": true,
        "rightHandDown": false,
        "activeKeyOverlays": [{ "key": "GamepadSouth", "side": "left" }],
        "parameters": {
          "CatParamLeftHandDown": 1.0,
          "CatParamRightHandDown": 0.0,
          "GamepadSouthDown": 1.0,
          "ParamMouseLeftDown": 0.0
        },
        "activeMotion": null,
        "activeExpression": null
      }
    },
    {
      "atMs": 30,
      "input": {
        "pressedKeys": [],
        "pressedMouseButtons": [],
        "connectedDevices": [],
        "lastResetReason": "queue_overflow"
      },
      "model": {
        "leftHandDown": false,
        "rightHandDown": false,
        "activeKeyOverlays": [],
        "parameters": {
          "CatParamLeftHandDown": 0.0,
          "CatParamRightHandDown": 0.0,
          "GamepadSouthDown": 0.0,
          "ParamMouseLeftDown": 0.0
        },
        "activeMotion": null,
        "activeExpression": null
      }
    },
    {
      "atMs": 40,
      "input": {
        "pressedKeys": ["KeyB"],
        "pressedMouseButtons": [],
        "connectedDevices": [],
        "lastResetReason": "queue_overflow"
      },
      "model": {
        "leftHandDown": false,
        "rightHandDown": true,
        "activeKeyOverlays": [{ "key": "KeyB", "side": "right" }],
        "parameters": {
          "CatParamLeftHandDown": 0.0,
          "CatParamRightHandDown": 1.0,
          "GamepadSouthDown": 0.0,
          "ParamMouseLeftDown": 0.0
        },
        "activeMotion": null,
        "activeExpression": null
      }
    },
    {
      "atMs": 50,
      "input": {
        "pressedKeys": [],
        "pressedMouseButtons": [],
        "connectedDevices": [],
        "lastResetReason": "service_restart"
      },
      "model": {
        "leftHandDown": false,
        "rightHandDown": false,
        "activeKeyOverlays": [],
        "parameters": {
          "CatParamLeftHandDown": 0.0,
          "CatParamRightHandDown": 0.0,
          "GamepadSouthDown": 0.0,
          "ParamMouseLeftDown": 0.0
        },
        "activeMotion": null,
        "activeExpression": null
      }
    }
  ]
}
